"address","location/lat","location/lng","name","numberOfGuests","roomType","stars","url"
"Napa, California, United States","38.24601","-122.27179","Charming Studio Resort","4","Private room in resort","5","https://www.airbnb.com/rooms/51309717"
"New York, United States","40.72973","-73.9883","Private &Secluded Carriage House in Prime Location","8","Entire home","5","https://www.airbnb.com/rooms/38153512"
"Le Grau-du-Roi, Occitanie, France","43.55","4.125","Studio + cabine au Boucanet","4","Entire rental unit","5","https://www.airbnb.com/rooms/20092400"
"Donostia, Spain","43.32147","-1.97852","Okendo by FeelFree Rentals","8","Entire rental unit","5","https://www.airbnb.com/rooms/24599095"
"Dover, Vermont, United States","42.99231","-72.8899","Chalet 4 bedroom+den Mt Snow","10","Entire home","5","https://www.airbnb.com/rooms/16187019"
"Lahaina, Hawaii, United States","21.00118","-156.65782","Kapalua Ridge Villa 1523  by Aloha Vacation Villas","6","Entire rental unit",,"https://www.airbnb.com/rooms/44444540"
"Paris, Île-de-France, France","48.869","2.302","Sweet Inn | Glamorous Apt. in the Triangle d'Or","6","Entire rental unit","4","https://www.airbnb.com/rooms/25645950"
"Penenden Heath, England, United Kingdom","51.21282","0.66155","The Dairy (UK32189)","8","Entire home",,"https://www.airbnb.com/rooms/47047038"
"East Riding of Yorkshire, England, United Kingdom","53.82365","-0.7622","Rascal Wood (27617)","14","Entire home","4.5","https://www.airbnb.com/rooms/47951481"
"Bellegarde, Occitanie, France","43.7521","4.51318","Stunning home in Bellegarde with 4 Bedrooms, WiFi","9","Entire home","5","https://www.airbnb.com/rooms/50071891"
"Liberdade, São Paulo, Brazil","-23.577","-46.638","Quarto tranquilo em casa com mesa para home office","1","Private room in home","5","https://www.airbnb.com/rooms/42647055"
"Braunton, United Kingdom","51.10889","-4.16067","HYGGE","6","Entire home","5","https://www.airbnb.com/rooms/23778959"
"Mississauga, Ontario, Canada","43.5589","-79.75262","Light House","3","Entire guest suite","4.5","https://www.airbnb.com/rooms/26816677"
"Tenby, United Kingdom","51.67184","-4.69468","Island View","6","Entire rental unit","4.5","https://www.airbnb.com/rooms/41761334"
"Russell, Northland, New Zealand","-35.26344","174.12306","The Strand","7","Entire home","5","https://www.airbnb.com/rooms/20804772"
"Porthleven, United Kingdom","50.083","-5.315","7 Bay View","5","Entire home",,"https://www.airbnb.com/rooms/22115975"
"Cornwall, England, United Kingdom","50.21506","-5.48185","Corner Cottage, 25 Virgin Street","4","Entire home",,"https://www.airbnb.com/rooms/44423842"
"Old Orchard Beach, Maine, United States","43.51232","-70.38198","Old Orchard Beach House","9","Entire home","5","https://www.airbnb.com/rooms/14836448"
"Dubai, United Arab Emirates","25.07504","55.13287","5 bed,sea facing & upgraded, Uber cool apartment","12","Entire rental unit","5","https://www.airbnb.com/rooms/4983174"
"Saint Margarets Bay, England, United Kingdom","51.15229","1.38422","Rockmount","5","Entire home",,"https://www.airbnb.com/rooms/50385209"
"Racale, Italy","39.94333","18.04818","VILLATRULLO MELOGRANO","12","Entire villa","4.5","https://www.airbnb.com/rooms/30764165"
"Nouzilly, Centre-Val de Loire, France","47.54348","0.7477","Chateau Gué Chapelle","16","Castle","5","https://www.airbnb.com/rooms/12362477"
"Greenport, New York, United States","41.10223","-72.36572","Greenport Village Rental","6","Entire home","5","https://www.airbnb.com/rooms/19135140"
"POKOLBIN, New South Wales, Australia","-32.73","151.318","Cotton House","8","Entire home","5","https://www.airbnb.com/rooms/29689998"
"Chedworth, near Cheltenham, England, United Kingdom","51.80771","-1.92432","Ivy Cottage (27591)","2","Entire home","5","https://www.airbnb.com/rooms/36653078"
"Golden, Colorado, United States","39.75597","-105.22382","The Golden Guest House — Downtown Golden","10","Entire home","5","https://www.airbnb.com/rooms/20802046"
"Lynmouth, United Kingdom","51.22978","-3.82788","Ferndale House, Lynmouth","6","Entire home","4.5","https://www.airbnb.com/rooms/23778157"
"Portesham, England, United Kingdom","50.67122","-2.56529","Olive Tree Cottage","6","Entire home","5","https://www.airbnb.com/rooms/49939019"
"Nottinghamshire, England, United Kingdom","53.22759","-0.68343","The Cherry Tree (UK35064)","10","Entire home","5","https://www.airbnb.com/rooms/51569182"
"Montvalezan, Auvergne-Rhône-Alpes, France","45.62698","6.86718","Apartement 8 people at the foot of the slopes","8","Entire serviced apartment",,"https://www.airbnb.com/rooms/50165637"
"San Francisco, California, United States","37.76107","-122.43955","Prime Central Flat with Wifi, Laundry, Parking","5","Entire rental unit","5","https://www.airbnb.com/rooms/23353721"
"POKOLBIN, New South Wales, Australia","-32.744","151.326","Vin de Vie","8","Entire home","5","https://www.airbnb.com/rooms/16745757"
"Corolla, North Carolina, United States","36.36891","-75.82856","6 bed/4 bath Corolla Light Resort home","12","Entire home",,"https://www.airbnb.com/rooms/45864837"
"Elton, England, United Kingdom","53.14416","-1.66837","Elton House","10","Entire home","5","https://www.airbnb.com/rooms/51833518"
"Chatham, Massachusetts, United States","41.68064","-70.01452","Modern, Attractive, Huge Yard, Walk to Beach!","8","Entire home","5","https://www.airbnb.com/rooms/48045941"
"Mollymook Beach, Australia","-35.33082","150.47527","Surfers Reef Escape!","15","Entire home","5","https://www.airbnb.com/rooms/28135152"
"Monopoli, Puglia, Italy, Italy","40.94441","17.21212","HELLO APULIA - Panoramic Trullo Blue Ocean View, Pet Friendly","8","Trullo","5","https://www.airbnb.com/rooms/37542997"
"Donostia, Spain","43.32507","-1.97359","Marugame by FeelFree Rentals","8","Entire rental unit","5","https://www.airbnb.com/rooms/31304529"
"London, United Kingdom","51.50694","-0.12365","★ Spacious Apartment - Covent Garden ★","4","Entire rental unit","5","https://www.airbnb.com/rooms/5531383"
"Haiku, Hawaii, United States","20.87598","-156.30268","beautiful 3 bedroom  2 1/2 bath upscale upcountry","6","Entire home","5","https://www.airbnb.com/rooms/17284404"
"Fitchburg, Wisconsin, United States","43.00303","-89.47951","Blue Ridge - 4 Kings 1 Queen","11","Entire home","5","https://www.airbnb.com/rooms/30185944"
"POKOLBIN, New South Wales, Australia","-32.744","151.325","Vista One","10","Entire home","5","https://www.airbnb.com/rooms/13716940"
"Daly City, California, United States","37.69287","-122.46836","❤️🥂Luxury 7b/6bath_Near SFO/WIFI👩‍💻 🆓 Parkng❤️","16","Entire home","5","https://www.airbnb.com/rooms/36770171"
"Madrid, Comunidad de Madrid, Spain","40.43047","-3.68316","VIP Best Airbnb Apartment Madrid 6 Bd 4Bth 10pax","10","Entire rental unit","5","https://www.airbnb.com/rooms/31559298"
"Los Angeles, California, United States","33.99764","-118.45438","Venice Designer Modern Farmhouse","4","Entire home","5","https://www.airbnb.com/rooms/24492121"
"New York, United States","40.80633","-73.94585","Huge 5BR Townhouse - LEGAL NYC B&B!","9","Entire townhouse","5","https://www.airbnb.com/rooms/4469650"
"Wagga Wagga, New South Wales, Australia","-35.11745","147.36537","""Hillsborough"" - boutique, luxury - up to 8 guests","8","Entire home",,"https://www.airbnb.com/rooms/52972312"
"Kapalua, Hawaii, United States","21.00014","-156.65745","Kapalua Ridge Villa 9-22  by Aloha Vacation Villas","5","Entire rental unit","5","https://www.airbnb.com/rooms/6119878"
"Aix-en-Provence, Provence-Alpes-Côte d'Azur, France","43.51236","5.40306","Castel du XIX à Aix Pce pool parc","10","Entire villa","5","https://www.airbnb.com/rooms/20064"
"Glenelg, South Australia, Australia","-34.97781","138.51218","Glenelg Skyline Penthouse","12","Entire rental unit","5","https://www.airbnb.com/rooms/53014563"
"San Diego, California, United States","32.84493","-117.18456","LUXURY Designer Home w/ INCREDIBLE VIEWS biz ready","4","Entire home","5","https://www.airbnb.com/rooms/17715343"
"New York, United States","40.74125","-73.98305","Gramercy 3 Bedroom with Private Outdoor","6","Entire rental unit","5","https://www.airbnb.com/rooms/51344110"
"Swanage, United Kingdom","50.6071","-1.94952","Pebbles","4","Entire rental unit",,"https://www.airbnb.com/rooms/25309081"
"Bright, Australia","-36.718","146.944","Bright River Rest","10","Entire home","4.5","https://www.airbnb.com/rooms/34482372"
"Oxon Hill, Maryland, United States","38.783","-77.015","3 BR DELUXE with BALCONY✦ Sleeps up to 10 Guests!","6","Entire guest suite","5","https://www.airbnb.com/rooms/45223678"
"Milano, Lombardia, Italy","45.45671","9.19833","Cozy and Beautiful Condo In the Heart Of Milan","10","Entire serviced apartment","5","https://www.airbnb.com/rooms/17607762"
"Aix-en-Provence, Provence-Alpes-Côte d'Azur, France","43.49311","5.43163","Confortable Bastide provençale avec piscine","10","Entire villa","5","https://www.airbnb.com/rooms/49921913"
"Sarlat-la-Canéda, Dordogne, France","44.886","1.22","La Trappezienne Sarlat","11","Entire villa","5","https://www.airbnb.com/rooms/36167151"
"Magnisia, Greece","35.37982","24.60532","Zen luxury home,pool,Near beach & amenities","16","Entire home",,"https://www.airbnb.com/rooms/53322616"
"Hook Norton, near Chipping Norton, United Kingdom","51.99633","-1.48777","The Old Sweet Shop (W44019)","6","Entire home","5","https://www.airbnb.com/rooms/30889458"
"Destin, Florida, United States","30.385","-86.427","Gorgeous 6 Bed, Pool, Guest Cottage, Beach & Bikes","15","Entire home","5","https://www.airbnb.com/rooms/13724397"
"Honolulu, Hawaii, United States","21.284","-157.837","Stunning Beaches, Close to Landmarks at Grand Waik","6","Entire condo","5","https://www.airbnb.com/rooms/54328907"
"Shingle Street, United Kingdom","52.04061","1.45163","Little Owl, Oxley Dairy","4","Entire home",,"https://www.airbnb.com/rooms/24959813"
"Fatih, İstanbul, Turkey","41.0049","28.95517","Well Furnished Flat in Historical Peninsula 501","2","Entire rental unit","4.5","https://www.airbnb.com/rooms/40000084"
"Isle of Wight, England, United Kingdom","50.729","-1.157","Impressive Victorian Gothic-style Coastal Home","10","Entire home","5","https://www.airbnb.com/rooms/21501381"
"Puerto Vallarta, Jalisco, Mexico","20.59711","-105.23728","Rent 5th Floor at Luxury Resort: Amazing Suites","10","Room in boutique hotel","5","https://www.airbnb.com/rooms/52570571"
"Poundstock, Bude, England, United Kingdom","50.77297","-4.52045","CIDER BARN (23865)","6","Entire home","4","https://www.airbnb.com/rooms/33893082"
"Kapalua, Hawaii, United States","21.00018","-156.65885","Kapalua Ridge Villa 1112 By Aloha Vacation Villas","4","Entire rental unit","5","https://www.airbnb.com/rooms/10853322"
"Sant Lluís, Illes Balears, Spain","39.84008","4.25503","Torret 46 - Casa menorquina a 10 minutos de Binibeca","6","Entire villa","4.5","https://www.airbnb.com/rooms/51615811"
"Newport, Rhode Island, United States","41.47342","-71.31566","At Home In Newport","5","Entire home","5","https://www.airbnb.com/rooms/20146408"
"Glenquarry, New South Wales, Australia","-34.51621","150.48242","Breconside House & Studio","14","Entire home",,"https://www.airbnb.com/rooms/50530457"
"Cadiz, Kentucky, United States","36.91062","-87.98879","Water Front Bungalow","8","Entire cabin",,"https://www.airbnb.com/rooms/50679380"
"Safety Beach, Australia","-30.09599","153.19974","Barellen Beach House - Beachfront, Luxury, Spa, Ocean Views","10","Entire home","5","https://www.airbnb.com/rooms/43836087"
"Warren, Vermont, United States","44.07773","-72.82243","Peaceful retreat. Become one with nature.","10","Entire home","5","https://www.airbnb.com/rooms/14993176"
"Provincetown, Massachusetts, United States","42.04942","-70.19056","Provincetown Retreat","4","Entire condo","5","https://www.airbnb.com/rooms/14552500"
"Bougival, Île-de-France, France","48.85883","2.12644","Magnificent villa with pool near Versailles","10","Entire villa",,"https://www.airbnb.com/rooms/50638227"
"Union Pier, Michigan, United States","41.82691","-86.70341","A Summerhaven - Union Pier Beauty With Private Heated Pool! 2023 Open!","7","Entire home","5","https://www.airbnb.com/rooms/45784247"
"South Lake Tahoe, California, United States","38.905","-119.972","Hot Tub, Pool Table, Backyard Trails - Happy Hiker","12","Entire home","5","https://www.airbnb.com/rooms/46214697"
"Newell, Queensland, Australia","-16.431","145.406","Mystique Beach House","8","Entire home","4.5","https://www.airbnb.com/rooms/3311383"
"Taitō-ku, Tōkyō-to, Japan","35.71851","139.79765","Modern&Traditional Condo - Asakusa*","6","Entire condo","5","https://www.airbnb.com/rooms/37328284"
"Honolulu, Hawaii, United States","21.283","-157.836","The Grand Islander by Hilton Grand Vacations - 2 B","6","Entire condo","5","https://www.airbnb.com/rooms/52386214"
"Wattisham, United Kingdom","52.12237","0.936","Tithe Barn at Wattisham Hall","7","Entire home",,"https://www.airbnb.com/rooms/40860800"
"Cape Town, Western Cape, South Africa","-33.95505","18.38254","Msangasanga - Superb family Villa in Camps Bay","10","Entire villa","5","https://www.airbnb.com/rooms/1253226"
"Corfu, Greece","39.74668","19.64892","Panorama Villa II, Arillas, Corfu","6","Entire home","5","https://www.airbnb.com/rooms/32326675"
"Washington, District of Columbia, United States","38.88544","-77.0031","Historic Capitol Hill Row Home Premier Location!","6","Entire townhouse","5","https://www.airbnb.com/rooms/33721595"
"Kihei, Hawaii, United States","20.70374","-156.44606","New! Modern Oceanfront Living, Experience the Best","6","Entire condo","5","https://www.airbnb.com/rooms/52535509"
"Costa Adeje, Canarias, Spain","28.09681","-16.71031","Prachtige luxevilla met infinitypool","16","Entire villa","5","https://www.airbnb.com/rooms/51995290"
"Norfolk, England, United Kingdom","52.64269","0.70167","Kestrel Barn-UK31353 (UK31353)","8","Entire home",,"https://www.airbnb.com/rooms/45080942"
"Westward Ho!, United Kingdom","51.04036","-4.2382","Seabreak","4","Entire rental unit",,"https://www.airbnb.com/rooms/23780615"
"Montville, Queensland, Australia","-26.71255","152.89153","The Lake House and Ocean View Villa","8","Entire home","4.5","https://www.airbnb.com/rooms/53013161"
"South Haven, Michigan, United States","42.40441","-86.28366","See Shore House on South Haven`s North Beach","12","Entire home","5","https://www.airbnb.com/rooms/9918637"
"Greater London, England, United Kingdom","51.51371","-0.12774","Three Bed at Cove St Martins","6","Entire rental unit","4.5","https://www.airbnb.com/rooms/37928810"
"Whitsunday Regional, Queensland, Australia","-20.289","148.787","Elementa Whitsundays House 7 - Wood Forest","8","Entire home","5","https://www.airbnb.com/rooms/30354070"
"Corolla, North Carolina, United States","36.341","-75.817","1325 Z Breeze * 2 Min Walk to Beach * Pool & Hot T","12","Entire home","4","https://www.airbnb.com/rooms/31761341"
"North Kuta, Indonesia","-8.65459","115.12629","Eco-Luxury Family Villa 250m to Echo Beach - CHSE","8","Entire villa","4.5","https://www.airbnb.com/rooms/32848898"
"New York, United States","40.72942","-74.00426","Luxury Townhouse w Balcony in West Village / Soho","4","Entire rental unit","5","https://www.airbnb.com/rooms/23692933"
"Florence, Toscana, Italy","43.768","11.253","[PONTE VECCHIO] Prestige and unique view","6","Entire rental unit","5","https://www.airbnb.com/rooms/46816135"
"Kailua Kona, Hawaii, United States","19.6078","-155.95734","Lush Oceanview Getaway w/Private Heated Pool, AC & Coastal Views: Honu O Kai","8","Entire home","5","https://www.airbnb.com/rooms/38762008"
"Traverse City, Michigan, United States","44.66716","-85.56004","Charming Traverse City home 10min to East Bay","6","Entire home","5","https://www.airbnb.com/rooms/41352867"
"Salcombe, England, United Kingdom","50.22471","-3.81762","Luxury House with sea view, near Salcombe","10","Entire home","5","https://www.airbnb.com/rooms/47791851"
"Whitsundays, Australia","-20.348","148.953","Casuarina 18 Ocean View Spacious Central Location","8","Entire home","4.5","https://www.airbnb.com/rooms/44283062"
"Saint Ives, United Kingdom","50.2162","-5.47978","21 Piazza","4","Entire home",,"https://www.airbnb.com/rooms/32538295"
"Dillon Beach, California, United States","38.251","-122.964","The Lookout!  Stunning Views!! Walk to Beach!  BBQ!  Fast WiFi!!  Dog Friendly!","8","Entire home","5","https://www.airbnb.com/rooms/44519699"
"Whitsundays, Queensland, Australia","-20.33379","148.95244","La Bella Waters 5 Ocean View Garden BBQ Buggy","8","Entire rental unit","5","https://www.airbnb.com/rooms/53691359"
"Greater London, England, United Kingdom","51.52401","-0.15746","Spacious Central Marylebone Townhouse | 2BR 2BA","4","Entire home","5","https://www.airbnb.com/rooms/38369720"
"Castel di Lucio, Sicily, Italy","37.88563","14.31091","Domus Sicily - Villa degli Ulivi dei Nebrodi","12","Entire rental unit",,"https://www.airbnb.com/rooms/49376380"
"Letter Finlay, Scotland, United Kingdom","56.98041","-4.88041","Black Sheep Hotels Cabins - Pine Tree","8","Entire cabin","5","https://www.airbnb.com/rooms/39938163"
"Anaheim, California, United States","33.80057","-117.93304","🌟🌟🌟🌟🌟 5 STAR ULTRA LUXURY 6 Bdrm Resort 💦💦","10","Entire home","5","https://www.airbnb.com/rooms/5241913"
"Philadelphia, Pennsylvania, United States","39.95284","-75.18281","Indulge w/ Spectacular City Views & Lux Amenities","4","Entire serviced apartment",,"https://www.airbnb.com/rooms/43913782"
"Torbay, England, United Kingdom","50.46867","-3.50587","Luxury villa with swimming pool, close to beaches","12","Entire home","5","https://www.airbnb.com/rooms/40192868"
"Ko Samui, Surat Thani, Thailand","9.56862","100.01685","Stunning Beachfront View w/Staff, Chef -SHA Extra+","8","Entire villa",,"https://www.airbnb.com/rooms/20960546"
"Avonside, New South Wales, Australia","-36.43495","148.70723","Luxury Snowy Mountain Chalet - Hot Tub+Skate Park","8","Entire chalet","5","https://www.airbnb.com/rooms/33475798"
"Montepulciano, Toscana, Italy","43.1","11.808","IL CASALE DI MANUELE 12, Emma Villas Exclusive","12","Entire villa","5","https://www.airbnb.com/rooms/30122257"
"Glengoulandie, near Aberfeldy, United Kingdom","56.64913","-4.01221","Frith View (UK5793)","6","Entire home","5","https://www.airbnb.com/rooms/30201060"
"Los Angeles, California, United States","34.02722","-118.44111","Centrally Located Designer Home With Huge Roofdeck","6","Entire townhouse",,"https://www.airbnb.com/rooms/53447910"
"Wailuku, Hawaii, United States","20.79456","-156.50915","Luxury Oceanfront ★ Designer Condo ★ Huge Views","8","Entire condo","5","https://www.airbnb.com/rooms/30713570"
"Hanalei, Hawaii, United States","22.20718","-159.4961","Palm One Surf House, The Heart of Hanalei TVR#5125","5","Entire home","5","https://www.airbnb.com/rooms/53340157"
"Rochester, New York, United States","43.12832","-77.53036","Luxury home with pool, hot tub, bar & spa bathroom","11","Entire home","5","https://www.airbnb.com/rooms/18728847"
"Fiskardo, Greece","38.4305","20.55667","Villa Cleopatra","6","Entire villa","5","https://www.airbnb.com/rooms/37620542"
"Indian Pass, Florida, United States","29.68243","-85.26434","Jaw Dropping Pet-friendly Home, gulf front, with heated pool","14","Entire home","5","https://www.airbnb.com/rooms/19464031"
"Kirkmichael, near Pitlochry, United Kingdom","56.71908","-3.52147","Glen Hideaway (UK5671)","4","Entire home","5","https://www.airbnb.com/rooms/30200928"
"Ormos Ammoudiou, Egeo, Greece","36.46","25.371","Nicoletta Ammoudi Suite A","4","Entire rental unit","5","https://www.airbnb.com/rooms/935721"
"Greater London, England, United Kingdom","51.51537","-0.12231","Cove Arne Street Three Bedroom","6","Entire rental unit","4.5","https://www.airbnb.com/rooms/37982592"
"Kapaʻa, Hawaii, United States","22.06043","-159.32036","Waipouli Beach Resort VIP Ocean Front Penthouse Villa! AC Pool","6","Entire villa",,"https://www.airbnb.com/rooms/48461828"
"Lahaina, Hawaii, United States","21.00388","-156.663","Kapalua Bay Villa 34G4  by Aloha Vacation Villas","4","Entire villa",,"https://www.airbnb.com/rooms/53421396"
"Great Langdale, England, United Kingdom","54.44851","-3.06746","Heron Place, Great Langdale","8","Entire cottage","5","https://www.airbnb.com/rooms/32754603"
"San Diego, California, United States","32.83616","-117.10564","Gorgeous 4 Bedroom House w/ Saltwater Pool!","12","Entire home","5","https://www.airbnb.com/rooms/47318447"
"Kihei, Hawaii, United States","20.75847","-156.45917","2 Bed/2 Bath Modern & Elegant Oceanfront Vistas","6","Entire condo","5","https://www.airbnb.com/rooms/51066797"
"Lewes, East Sussex, United Kingdom","50.89322","-0.01078","Country house with grounds near Lewes/Brighton","12","Entire home","5","https://www.airbnb.com/rooms/6815703"
"Fitzroy, Victoria, Australia","-37.79534","144.98061","INTERIOR DESIGNED HOUSE IN FITZROY","6","Entire home","5","https://www.airbnb.com/rooms/5850884"
"Folly Beach, South Carolina, United States","32.66595","-79.91368","Height of Folly by StayDuvet | Beachfront on Folly","12","Entire home","4.5","https://www.airbnb.com/rooms/53525503"
"El Castillo, A, Costa Rica","10.4286","-84.75943","Majestic Lodge. Luxury Home w/ Pool and Volcano View","16","Entire home","5","https://www.airbnb.com/rooms/22289674"
"Red Hill, Victoria, Australia","-38.3683","144.98613","JOIE DE VIVRE - Winery Location with Tennis Court","9","Entire home","5","https://www.airbnb.com/rooms/43885463"
"Ceará-Mirim, State of Rio Grande do Norte, Brazil","-5.58029","-35.22663","Luxury house in Praia de Jacumã by Carpediem","16","Entire home","5","https://www.airbnb.com/rooms/47879496"
"Donostia, Euskadi, Spain","43.31643","-1.98593","LA CONCHA BEACHVIEW apartment","8","Entire rental unit","5","https://www.airbnb.com/rooms/52997744"
"West Columbia, South Carolina, United States","33.96399","-81.16847","Southern style home w/2 front patios & back pond.","2","Private room in home","5","https://www.airbnb.com/rooms/45988588"
"Ronald, United States","47.27283","-121.08059","Beechwood Lakehouse","8","Entire home","4.5","https://www.airbnb.com/rooms/24263460"
"Oxford, Mississippi, United States","34.363","-89.461","Oxford home close to everything!","6","Entire home",,"https://www.airbnb.com/rooms/50876977"
"San Diego, California, United States","32.829","-117.275","Vista Del Mar by AvantStay | Stunning La Jolla Home w/ Pool, Hot Tub & Rooftop Patio, 0.5mi to Windansea Beach","12","Entire home","5","https://www.airbnb.com/rooms/52758916"
"Ostuni, Brindisi, Puglia, Italy","40.695","17.551","Villa Agave Ostuni with Pool","10","Trullo","5","https://www.airbnb.com/rooms/19806556"
"Evanston, Illinois, United States","42.0268","-87.68848","A place for scholars & solo adventurers w/parking","1","Private room in home","5","https://www.airbnb.com/rooms/15521681"
"La Quinta, California, United States","33.635","-116.27","RARE FIND-5 STAR RATED-STUNNING VIEWS-POOL-SPA 4br-100179","10","Entire home","5","https://www.airbnb.com/rooms/21553191"
"Cruz Bay, U.S. Virgin Islands","18.32222","-64.78609","Villa - July 09 to 16 or July 16 to 23, 2022","10","Entire villa",,"https://www.airbnb.com/rooms/32253553"
"Clearwater, Florida, United States","27.97421","-82.82738","Clearwater Beach, FL - Club Wyndham Resort","8","Entire condo","5","https://www.airbnb.com/rooms/41352849"
"Princes Gate, Wales, United Kingdom","51.78595","-4.69111","Cilrhiw Country House - Princes Gate - Narberth","12","Entire home","5","https://www.airbnb.com/rooms/48876683"
"West Ashton, England, United Kingdom","51.30143","-2.17925","Rent an entire Castle (sleeps 16) & Grounds","16","Castle","5","https://www.airbnb.com/rooms/30847041"
"Sandys Parish, Bermuda","32.28158","-64.87355","Sunrise Cottage","6","Entire home","5","https://www.airbnb.com/rooms/18991832"
"Aspen, Colorado, United States","39.18034","-106.85804","Ski in/Ski out Luxury Ritz Carlton Club","8","Entire serviced apartment","5","https://www.airbnb.com/rooms/29805173"
"Nags Head, North Carolina, United States","35.98566","-75.63835","Coastal LegaSea","16","Entire home","5","https://www.airbnb.com/rooms/38947252"
"Serralunga d'Alba, Cuneo, Italy","44.612","7.994","Villa Marenca, scenic views of Barolo","10","Entire villa","5","https://www.airbnb.com/rooms/36835570"
"Malibu, California, United States","34.03374","-118.72374","Beachfront Townhouse with Stunning Ocean Views","6","Entire rental unit","5","https://www.airbnb.com/rooms/16912825"
"Bethania, United Kingdom","52.2507","-4.10241","Sgubor Nantcoy","2","Entire home",,"https://www.airbnb.com/rooms/41579055"
"Accord, New York, United States","41.78538","-74.2295","All aboard! Revitalized 1902 train depot + caboose","8","Train","5","https://www.airbnb.com/rooms/40040863"
"Dillon Beach, California, United States","38.256","-122.97","Breaking Waves!  On the Bluff!  AMAZING VIEWS!!  BBQ! Fast WiFi!  Walk to Beach!!!","4","Entire home","5","https://www.airbnb.com/rooms/513513"
"Mount Morris, New York, United States","42.6525","-77.95331","The Lodge on Letchworth","11","Entire cabin","5","https://www.airbnb.com/rooms/42929507"
"Fairbanks, Alaska, United States","64.90817","-147.39529","Aurora Villa 御墅极光 D2B(1)Deluxe double bed  Room","4","Room in boutique hotel","5","https://www.airbnb.com/rooms/31314964"
"Lahaina, Hawaii, United States","20.93987","-156.69068","Studio Westin Ka'anapali Resort King Bed SS1","4","Private room in serviced apartment","5","https://www.airbnb.com/rooms/29095678"
"Horsmonden, England, United Kingdom","51.14608","0.43736","Old All Saints Church","6","Entire home","5","https://www.airbnb.com/rooms/49956636"
"Cartagena, Bolívar, Colombia","10.42087","-75.54482","CASA AZZURRA LUX BOUTIQUE HOUSE GETSEMANÍ","10","Entire home","5","https://www.airbnb.com/rooms/47492154"
