"address","location/lat","location/lng","name","numberOfGuests","roomType","stars","url"
"Coral Bay, St. John, U.S. Virgin Islands","18.33669","-64.71965","Calichi At Picture Point - The Orchid Villa","4","Entire villa","4.5","https://www.airbnb.com/rooms/28868096"
"Sayulita, Nayarit, Mexico","20.87759","-105.43066","Casa Orion -Tropical Paradise in magical Sayulita","10","Entire home","5","https://www.airbnb.com/rooms/40562421"
"Tabanan, Bali, Indonesia","-8.563","115.038","Luxury Unique Cloud Villa Ocean View","7","Entire villa","5","https://www.airbnb.com/rooms/37959280"
"Denison, Texas, United States","33.84194","-96.6339","Lake Texoma Cabin on a Small Lake - 3BR Sleeps 18","16","Entire cabin","4.5","https://www.airbnb.com/rooms/38506255"
"Saint Augustine, Florida, United States","29.79345","-81.26091","Large Ocean Beach House with Pool for 12","12","Entire home","5","https://www.airbnb.com/rooms/8113621"
"Santa Rosa Beach, Florida, United States","30.306","-86.09","Location! Location! Location! GULF VIEWS, Steps to","13","Entire home","5","https://www.airbnb.com/rooms/48637292"
"Newport Beach, California, United States","33.58152","-117.84162","Marriott's Newport Coast Villas","8","Entire condo",,"https://www.airbnb.com/rooms/48210831"
"Cilmery, United Kingdom","52.15754","-3.45785","Canoldy","7","Entire home","5","https://www.airbnb.com/rooms/25767428"
"Carnelian Bay, California, United States","39.21194","-120.09713","The Carnelian Bay Escape - Hot Tub/Close 2 Beach!","7","Entire cabin","4.5","https://www.airbnb.com/rooms/50562104"
"Vodnjan, Croatia","44.95499","13.85403","*Amazing modern apartment with 2 bedrooms*","5","Entire rental unit",,"https://www.airbnb.com/rooms/32123383"
"Lignan-de-Bordeaux, Gironde, France","44.79629","-0.41435","Gîte-de France-Ensuite-Countryside view","13","Entire villa","5","https://www.airbnb.com/rooms/33904163"
"Venice Beach, California, United States","33.99008","-118.46611","BEST Venice Locale: the full Venice Experience!","8","Entire home","5","https://www.airbnb.com/rooms/2291457"
"Soorts-Hossegor, Nouvelle-Aquitaine, France","43.66837","-1.43783","Villa jardin piscine et la plage a 2 minutes","14","Entire villa",,"https://www.airbnb.com/rooms/52023139"
"Kapolei, Hawaii, United States","21.33408","-158.12172","**Ko Olina Beach Villa Frontal Oceanview 2 bd/2 ba","4","Entire condo","5","https://www.airbnb.com/rooms/15633180"
"Fortingall, near Aberfeldy, Scotland, United Kingdom","56.60079","-4.03519","Ardchoille Cottage (UK10285)","6","Entire home",,"https://www.airbnb.com/rooms/40932817"
"Menai Bridge, Wales, United Kingdom","53.24023","-4.1883","Pumpkin Lodge","4","Entire home",,"https://www.airbnb.com/rooms/48622131"
"Charmouth, near Lyme Regis, England, United Kingdom","50.74762","-2.92265","The Barn - UKC3750 (UKC3750)","4","Entire home",,"https://www.airbnb.com/rooms/40933060"
"Haifa, Haifa District, Israel","32.81158","34.96047","Exquisite Sunset Penthouse","8","Entire rental unit","5","https://www.airbnb.com/rooms/25909435"
"Pett, United Kingdom","50.89488","0.65644","Holly Cottage (PW7)","9","Entire home","5","https://www.airbnb.com/rooms/30918194"
"Golden, Colorado, United States","39.75597","-105.22382","The Golden Guest House — Downtown Golden","10","Entire home","5","https://www.airbnb.com/rooms/20802046"
"New York, United States","40.76229","-73.99076","Highly Disinfected | Perfectly Located Near Restaurants, Shops, & Sites","6","Entire rental unit","4.5","https://www.airbnb.com/rooms/37586370"
"Corolla, North Carolina, United States","36.36891","-75.82856","6 bed/4 bath Corolla Light Resort home","12","Entire home",,"https://www.airbnb.com/rooms/45864837"
"Wilderswil, Bern, Switzerland","46.66608","7.86084","Unique View & Wellness Entire 3rd floor","13","Entire rental unit","5","https://www.airbnb.com/rooms/50495291"
"Alvechurch, United Kingdom","52.34815","-1.97172","Fenn House (29685)","8","Entire home",,"https://www.airbnb.com/rooms/30909973"
"Dover, Vermont, United States","42.99231","-72.8899","Chalet 4 bedroom+den Mt Snow","10","Entire home","5","https://www.airbnb.com/rooms/16187019"
"Somerford Keynes, England, United Kingdom","51.64636","-1.96971","Nuthatch (UKC158)","10","Entire home","5","https://www.airbnb.com/rooms/49537652"
"Mississauga, Ontario, Canada","43.5589","-79.75262","Light House","3","Entire guest suite","4.5","https://www.airbnb.com/rooms/26816677"
"Rome, Lazio, Italy","41.9","12.462","BigFamilyFlats-Sistine Chapel 1 Apt-20 pax/8 rooms","16","Entire rental unit","5","https://www.airbnb.com/rooms/17931967"
"Powys, Wales, United Kingdom","52.48324","-3.46822","Upper Gwerneirin (UK31627)","8","Entire home","5","https://www.airbnb.com/rooms/45706876"
"Porthleven, United Kingdom","50.083","-5.315","7 Bay View","5","Entire home",,"https://www.airbnb.com/rooms/22115975"
"Llanymawddwy, Wales, United Kingdom","52.75666","-3.62958","Ty Gillwood (UK13244)","6","Entire home",,"https://www.airbnb.com/rooms/40702550"
"Lynmouth, United Kingdom","51.22937","-3.8247","River Cottage","6","Entire home","4.5","https://www.airbnb.com/rooms/23780298"
"Torino, Piemonte, Italy","45.083","7.636","Melograno","2","Entire rental unit","4.5","https://www.airbnb.com/rooms/33681919"
"Winsford, United Kingdom","51.10128","-3.56361","Royal Oak Farm (EWR)","9","Entire home","4.5","https://www.airbnb.com/rooms/30220117"
"Davenport, Florida, United States","28.31707","-81.65894","2191 LC - Windsor Island","16","Entire home",,"https://www.airbnb.com/rooms/53606124"
"Lynmouth, United Kingdom","51.22978","-3.82788","Ferndale House, Lynmouth","6","Entire home","4.5","https://www.airbnb.com/rooms/23778157"
"Albuquerque, New Mexico, United States","35.17278","-106.62051","North Valley Hideaway near Balloon Fiesta Park","8","Entire home","5","https://www.airbnb.com/rooms/25841222"
"North Kuta, Bali, Indonesia","-8.67","115.166","8BR Villa Mason - Minggu Villas","16","Entire villa","4.5","https://www.airbnb.com/rooms/30006054"
"Surf City, New Jersey, United States","39.656","-74.179","Surf Shack LBI - 4 bed/3 bath w/great Bay Views","10","Entire home","5","https://www.airbnb.com/rooms/41406590"
"Lee-on-the-Solent, near Portsmouth, England, United Kingdom","50.80329","-1.20722","Seaways (UK11416)","6","Entire home","5","https://www.airbnb.com/rooms/37399407"
"POKOLBIN, New South Wales, Australia","-32.733","151.322","Eagles Landing","8","Entire home","5","https://www.airbnb.com/rooms/16770760"
"Hook Norton, near Chipping Norton, United Kingdom","51.99633","-1.48777","The Old Sweet Shop (W44019)","6","Entire home","5","https://www.airbnb.com/rooms/30889458"
"Shelter Island, New York, United States","41.04819","-72.36287","Secluded and Sheltered","8","Entire home","5","https://www.airbnb.com/rooms/3544267"
"Aix-en-Provence, Provence-Alpes-Côte d'Azur, France","43.49311","5.43163","Confortable Bastide provençale avec piscine","10","Entire villa","5","https://www.airbnb.com/rooms/49921913"
"Llwyngwril, near Aberdovey, United Kingdom","52.66526","-4.08159","Ty Newydd (UK6143)","8","Entire home","5","https://www.airbnb.com/rooms/30914413"
"Port-Saint-Louis-du-Rhône, Provence-Alpes-Côte d'Azur, France","43.39729","4.79323","Charming villa in Camargue with private pool","4","Entire villa",,"https://www.airbnb.com/rooms/53352368"
"Attersee am Attersee, Oberösterreich, Austria","47.915","13.537","B & B  Attersee","9","Entire home","5","https://www.airbnb.com/rooms/30731832"
"Allithwaite, near Grange-over-Sands, England, United Kingdom","54.17783","-2.94025","Samhach Lodge-UK11301 (UK11301)","2","Entire home","5","https://www.airbnb.com/rooms/40940720"
"Lahaina, Hawaii, United States","21.00131","-156.66203","Kapalua Bay Villa 17B4  by Aloha Vacation Villas","2","Entire rental unit",,"https://www.airbnb.com/rooms/44444135"
"Corridonia, Marche, Italy","43.24827","13.49051","Villa Chibo","11","Entire home",,"https://www.airbnb.com/rooms/48222205"
"Kapaʻa, Hawaii, United States","22.06021","-159.32134","Waipouli Beach Resort Exquisite Luxury Oceanview - Best Location! Aloha!","8","Entire rental unit","5","https://www.airbnb.com/rooms/48462875"
"Paris, Île-de-France, France","48.866","2.352","Amazing Renovated Haussmanien Appart w/Aircon&Lift","8","Entire serviced apartment","5","https://www.airbnb.com/rooms/49186423"
"Agadir, Souss Massa, Morocco","30.4307","-9.55973","Très propre appartement a vous accueillir","6","Entire condo","4.5","https://www.airbnb.com/rooms/52251214"
"South Lake Tahoe, California, United States","38.9016","-119.95925","Heavenly Pines-Hot Tub, Family Friendly,Great Yard","12","Entire home","4.5","https://www.airbnb.com/rooms/38127157"
"Cape Town, Western Cape, South Africa","-33.95888","18.38423","Comfy Camps Bay Family Villa sleeps 10 with pool","10","Entire villa","4.5","https://www.airbnb.com/rooms/39957808"
"Jardim das Colinas, São Paulo, Brazil","-23.20681","-45.91419","Casa Aconchegante c Lareira e Wi-Fi em Condomínio!","8","Entire home","5","https://www.airbnb.com/rooms/51743717"
"Clinton, New York, United States","43.05467","-75.36668","Charming, Recently Remodeled Cape Cod","6","Entire home",,"https://www.airbnb.com/rooms/5665261"
"Petham, near Canterbury, England, United Kingdom","51.21432","1.03593","Petham Hide (M555103)","8","Entire home",,"https://www.airbnb.com/rooms/40959162"
"Middle Duntisbourne, near Cirencester, United Kingdom","51.75853","-2.02591","Flowers Barn (UKC2118)","6","Entire home",,"https://www.airbnb.com/rooms/30887232"
"Cabrils, Spain","41.53105","2.36833","Desmais an outstanding design and unbeatable views","10","Entire home","5","https://www.airbnb.com/rooms/7298955"
"Veyrier-du-Lac, Auvergne-Rhône-Alpes, France","45.88659","6.18031","Villa sur les hauteurs du lac d'Annecy","10","Entire home","5","https://www.airbnb.com/rooms/42901344"
"Aix-en-Provence, Provence-Alpes-Côte d'Azur, France","43.51236","5.40306","Castel du XIX à Aix Pce pool parc","10","Entire villa","5","https://www.airbnb.com/rooms/20064"
"Alcúdia, Illes Balears, Spain","39.83692","3.11445","Villa Blau","7","Entire villa","5","https://www.airbnb.com/rooms/44574087"
"Montville, Queensland, Australia","-26.71255","152.89152","The Lake House and Ocean View Villa","8","Entire home","4.5","https://www.airbnb.com/rooms/53013161"
"Nashville, Tennessee, United States","36.163","-86.777","WALK to all the bars! DOWNTOWN Nashville Loft! 404","8","Entire loft","5","https://www.airbnb.com/rooms/16353363"
"Birmingham, Alabama, United States","33.49099","-86.80873","Charles on 11th - Beautifully Restored Historic So","16","Entire home","5","https://www.airbnb.com/rooms/45205454"
"Wimberley, Texas, United States","30.01436","-98.06212","Star Ranch- Exquisite Acreage","12","Entire home","4.5","https://www.airbnb.com/rooms/21405824"
"Provincetown, Massachusetts, United States","42.04942","-70.19056","Provincetown Retreat","4","Entire condo","5","https://www.airbnb.com/rooms/14552500"
"Cornwall, England, United Kingdom","50.33564","-4.63495","Little Quoin (EC96568)","4","Entire home",,"https://www.airbnb.com/rooms/51645641"
"Puerto Vallarta, Jalisco, Mexico","20.59702","-105.23577","WOW! Two Penthouses-Entire Floor at Luxury Resort","10","Room in boutique hotel","5","https://www.airbnb.com/rooms/52234556"
"Bangalow, New South Wales, Australia","-28.68641","153.53111","Bangalow Queenslander & Pool","9","Entire home","5","https://www.airbnb.com/rooms/27065168"
"Tel Aviv-Yafo, Tel Aviv District, Israel","32.07778","34.76679","Full Sea View on The Beach w/ Balcony & Parking","8","Entire rental unit","4.5","https://www.airbnb.com/rooms/39514199"
"San Francisco, California, United States","37.75322","-122.44451","Modern Minimalist Condo with Great City Views","5","Entire condo","5","https://www.airbnb.com/rooms/9328077"
"Paignton, England, United Kingdom","50.4429","-3.55751","16 Belvedere Court (BCBE16B)","2","Entire rental unit","5","https://www.airbnb.com/rooms/40940360"
"Greater London, England, United Kingdom","51.51935","-0.27588","The Executive","2","Entire condo","5","https://www.airbnb.com/rooms/52151824"
"Greater London, England, United Kingdom","51.51586","-0.07541","The Aldgate Flats","3","Entire rental unit","5","https://www.airbnb.com/rooms/47527135"
"Lecci, Corse, France","41.64563","9.33446","Villa à St Cyprien 10 pers, piscine, plage à 3min","10","Entire villa","5","https://www.airbnb.com/rooms/49866739"
"Honolulu, Hawaii, United States","21.27964","-157.82525","Ohia Waikiki Studio Suites Penthouse","8","Room in hotel","5","https://www.airbnb.com/rooms/48996819"
"New York, United States","40.79681","-73.93485","Luxury Duplex Manhattan Home w/ Private Roof Deck","8","Entire condo","5","https://www.airbnb.com/rooms/34478718"
"Greater London, England, United Kingdom","51.52085","-0.17888","Little Venice canal/Paddington Super Large room","2","Private room in rental unit","5","https://www.airbnb.com/rooms/49784604"
"Kuta Utara, Bali, Indonesia","-8.6761","115.16395","Seminyak Ultra-luxe 6/7BR dream home, top location","16","Entire villa","5","https://www.airbnb.com/rooms/31106594"
"New Orleans, Louisiana, United States","29.964","-90.059","Chef Owned FQ Home w/Courtyard & Catering Options","6","Entire home","5","https://www.airbnb.com/rooms/52703812"
"Cilmery, United Kingdom","52.15825","-3.45779","Hafan Llewelyn","6","Entire home","5","https://www.airbnb.com/rooms/25526649"
"Omro, Wisconsin, United States","44.0455","-88.66121","Unique country charm close to all city attractions","6","Entire home","5","https://www.airbnb.com/rooms/44591670"
"Destin, Florida, United States","30.39539","-86.51166","Famous Emerald Grande Resort! 3BR Suite","8","Entire condo",,"https://www.airbnb.com/rooms/53379295"
"Ceglie Messapica, Puglia, Italy, Italy","40.624","17.566","Trulli Itaka, now with 15% discount","8","Trullo","4.5","https://www.airbnb.com/rooms/16306266"
"Landford, England, United Kingdom","50.96971","-1.61891","Lakeview Lodge (UK33049)","6","Entire home","5","https://www.airbnb.com/rooms/48498246"
"North Yorkshire, England, United Kingdom","54.06836","-2.2767","Cragdale Lodge (UK31665)","6","Entire home",,"https://www.airbnb.com/rooms/45780188"
"Greater London, England, United Kingdom","51.51085","-0.18948","Amazing 2 Bed Apartment, Moments From Hyde Park!","6","Entire rental unit","5","https://www.airbnb.com/rooms/39521888"
"Hakuba-mura, Kitaazumi-gun, Nagano-ken, Japan","36.688","137.836","サルジ　Salji","10","Entire home","5","https://www.airbnb.com/rooms/31625705"
"Sorbiers, Auvergne-Rhône-Alpes, France","45.49928","4.44923","Villa contemporaine, 10 Pers, vue exceptionnelle","10","Entire home","5","https://www.airbnb.com/rooms/44173059"
"Berlin, Germany","52.485","13.425","Central LEGAL flat for 11 / 5BR 3Bath. Kreuzkölln!","11","Entire rental unit","5","https://www.airbnb.com/rooms/13868134"
"Dubai, United Arab Emirates","25.076","55.132","PalmBay @ JBR 4 bedroom sea view apartment","8","Entire rental unit","4.5","https://www.airbnb.com/rooms/2179086"
"Kihei, Hawaii, United States","20.70374","-156.44606","New! Modern Oceanfront Living, Experience the Best","6","Entire condo","5","https://www.airbnb.com/rooms/52535509"
"Near Tenterden, England, United Kingdom","51.06358","0.83197","Leacon Hall Oast (M491255)","6","Entire home","5","https://www.airbnb.com/rooms/34718376"
"Rhydlewis, United Kingdom","52.11399","-4.41798","Murmur y Ceri","6","Entire home",,"https://www.airbnb.com/rooms/30631916"
"Kapalua, Hawaii, United States","21.00018","-156.65885","Kapalua Ridge Villa 1112 By Aloha Vacation Villas","4","Entire rental unit","5","https://www.airbnb.com/rooms/10853322"
"Bilbo, Euskadi, Spain","43.26925","-2.92708","Apartment Vintage Calatrava","3","Entire rental unit","5","https://www.airbnb.com/rooms/23924114"
"Driggs, Idaho, United States","43.731","-111.116","Tributary 4 BR Home in Driggs, ID","8","Entire home","5","https://www.airbnb.com/rooms/43908989"
"Duck, North Carolina, United States","36.153","-75.742","2150 A Spotted Duck * 4 Min Walk to Beach * Dog Fr","15","Entire home","4.5","https://www.airbnb.com/rooms/32015871"
"Pula, Istarska županija, Croatia","44.84969","13.85365","Villa Lealeana, Pula","16","Entire villa","4.5","https://www.airbnb.com/rooms/52987961"
"Lahaina, Hawaii, United States","20.96927","-156.6783","Gorgeous 3 bedroom villa at the Sands of Kahana","8","Entire condo","4.5","https://www.airbnb.com/rooms/40054099"
"Lubenham, near Market Harborough, United Kingdom","52.4901","-0.97282","Waxwing Cottage (UKC2000)","6","Entire home","5","https://www.airbnb.com/rooms/30910286"
"Llanglydwen, Narberth, United Kingdom","51.91409","-4.63374","Ysgubor Uchaf (OWW)","8","Entire home","5","https://www.airbnb.com/rooms/30913061"
"Sevierville, Tennessee, United States","35.78724","-83.51474","The Reilly Lodge on 20 acres","14","Entire home","5","https://www.airbnb.com/rooms/48601894"
"Betley, near Nantwich, United Kingdom","53.04271","-2.37128","Buddileigh Farm (26951)","8","Entire home","5","https://www.airbnb.com/rooms/30860448"
"Rome, Lazio, Italy","41.907","12.479","Vittoria Top Family for 6 near the Spanish steps","6","Entire vacation home","5","https://www.airbnb.com/rooms/19975077"
"Marquette, Michigan, United States","46.548","-87.383","Northern Lights Nest","6","Entire home","5","https://www.airbnb.com/rooms/51170266"
"Takoma Park, Maryland, United States","38.97933","-77.01285","Lovely 4BR Home. Porch. Walk to creek and dining.","8","Entire home","5","https://www.airbnb.com/rooms/14694714"
"Le Touquet-Paris-Plage, Hauts-de-France, France","50.51448","1.58335","**Beach, Dunes&Sea** Exceptional Panoramic Views","14","Entire home","4.5","https://www.airbnb.com/rooms/8954946"
"Pokolbin, New South Wales, Australia","-32.74459","151.32903","Willow's Green","8","Entire home",,"https://www.airbnb.com/rooms/53760911"
"Agios Markos, Greece","39.71048","19.82408","Majestic Villa Manavra in Corfu (1166114)","6","Entire villa","5","https://www.airbnb.com/rooms/19172545"
"Santa Rosa Beach, Florida, United States","30.317","-86.12","Under 5 min. walk to beach, Private pool, & courty","8","Entire home","5","https://www.airbnb.com/rooms/50394116"
"Milano, Lombardia, Italy","45.45671","9.19833","Cozy and Beautiful Condo In the Heart Of Milan","10","Entire serviced apartment","5","https://www.airbnb.com/rooms/17607762"
"Greater London, England, United Kingdom","51.51549","-0.20369","Portobello Mews House Sleeps 8 with 4 bathrooms","8","Entire home","5","https://www.airbnb.com/rooms/45908761"
"Noord, Aruba","12.57334","-70.03865","NEW! Villa de Leon, suitable for 14 persons. 5 bedrooms, 5 bathrooms","14","Entire villa","5","https://www.airbnb.com/rooms/53314767"
"Sunrise Beach, Queensland, Australia","-26.41237","153.10823","ULTIMATE NOOSA Six Bedroom Luxury with WATERSLIDE!","13","Entire home","5","https://www.airbnb.com/rooms/23453341"
"Folly Beach, South Carolina, United States","32.647","-79.959","5 Bedroom 4 Bath ~ The Salt House On Folly","14","Entire home","5","https://www.airbnb.com/rooms/27188098"
"Cape Town, Western Cape, South Africa","-33.96621","18.38047","Ty Gwyn Villa","6","Entire villa","4.5","https://www.airbnb.com/rooms/14561253"
"Broadbeach Waters, Queensland, Australia","-28.03513","153.4183","Whitehaven @ Broadbeach","11","Entire home","5","https://www.airbnb.com/rooms/19952265"
"Isle of Wight, England, United Kingdom","50.729","-1.157","Impressive Victorian Gothic-style Coastal Home","10","Entire home","5","https://www.airbnb.com/rooms/21501381"
"Burley in Wharfedale, England, United Kingdom","53.90105","-1.74031","Family Friendly Barn Ilkley, Amazing Views,Hot Tub","10","Entire home","5","https://www.airbnb.com/rooms/37733836"
"West Cape May, New Jersey, United States","38.936","-74.932","5 Bed, 4.5 bath, pool, pet friendly, all new","12","Entire home","4.5","https://www.airbnb.com/rooms/54262027"
"Rome, Lazio, Italy","41.898","12.467","IMPERIAL SUITE SFORZA!","10","Entire rental unit","5","https://www.airbnb.com/rooms/1780721"
"Oak Bluffs, Massachusetts, United States","41.43959","-70.58017","Charming Vacation Home in Oak Bluffs.","8","Entire home","5","https://www.airbnb.com/rooms/53240538"
"Lexington, Kentucky, United States","38.02364","-84.52913","Updated home, great location, outdoor space","6","Entire home","5","https://www.airbnb.com/rooms/47771970"
"Donostia, Euskadi, Spain","43.32532","-1.97606","Jai Alai 54 by FeelFree Rentals","8","Entire rental unit","5","https://www.airbnb.com/rooms/45587078"
"São Sebastião, São Paulo, Brazil","-23.799","-45.547","Casa em condomínio fechado Paúba 4 suítes","16","Entire home",,"https://www.airbnb.com/rooms/746932494902791700"
"Rome, Lazio, Italy","41.89857","12.49136","Daphne Terrace  - TreasureRome Luxury Collection","5","Entire rental unit","5","https://www.airbnb.com/rooms/9108014"
"Portland, Maine, United States","43.66454","-70.24935","Elegant, Stunning Condo with Sunny Patio","4","Entire condo","5","https://www.airbnb.com/rooms/18433978"
"Biddeford, Maine, United States","43.40769","-70.38903","Ocean view Beach Cottage with private beach","8","Entire home","5","https://www.airbnb.com/rooms/17151694"
"Whitewood, South Dakota, United States","44.49839","-103.4546","Rally Rental close to The Full Throttle Saloon","10","Entire home","5","https://www.airbnb.com/rooms/37917308"
"Los Altos Hills, California, United States","37.34199","-122.11106","Live in a Work of Art, Design by Aaron Green","4","Entire home",,"https://www.airbnb.com/rooms/7929353"
"San Diego, California, United States","32.74566","-117.18146","Penthouse ~Amazing Views ~Modern Gem ~Close to All","7","Entire condo","5","https://www.airbnb.com/rooms/30209898"
"Corniglia, Liguria, Italy","44.11929","9.70703","Casa Picco dei Gabbiani - Luxury Oasis with Garden","6","Entire home","5","https://www.airbnb.com/rooms/25869431"
"Rome, Lazio, Italy","41.906","12.483","Thebestinrome Vite Exclusive","8","Entire rental unit","5","https://www.airbnb.com/rooms/17823804"
"Belgrade, Minnesota, United States","45.47901","-94.92125","Feathered Acres Learning Farm (Entire Barn Rental)","11","Barn","4.5","https://www.airbnb.com/rooms/50417984"
"Rocky Point, Prince Edward Island, Canada","46.194","-63.17801","Coastal Golf Cottage with Beach Access, Sleeps 14","14","Entire cottage","5","https://www.airbnb.com/rooms/26322540"
"Chabeuil, Auvergne-Rhône-Alpes, France","44.89356","5.01358","Ferme St Pierre  Vercors-Drôme des collines","12","Entire home","5","https://www.airbnb.com/rooms/49083362"
"Saint Ives, United Kingdom","50.2162","-5.47978","21 Piazza","4","Entire home",,"https://www.airbnb.com/rooms/32538295"
"Cefalù, Sicilia, Italy","38.014","14.017","Villa Palomina 8, Emma Villas Exclusive","8","Entire villa",,"https://www.airbnb.com/rooms/54153426"
"Malé, Maldives","4.30616","73.50672","All inclusive Water Villa - Free Transfer","3","Private room in resort",,"https://www.airbnb.com/rooms/748239739491614000"
"North Miami, Florida, United States","25.887","-80.194","Luxury Vacation Getaway in Miami","12","Entire home","4.5","https://www.airbnb.com/rooms/21205872"
"Alcudia, Majorca / Mallorca, Spain","39.85017","3.06974","Villa Vertent","4","Entire villa","4.5","https://www.airbnb.com/rooms/22010953"
"Canyon Lake, Texas, United States","29.84982","-98.16251","Oxbow Oasis | Sleeps 10 | Brand New House","10","Entire bungalow","5","https://www.airbnb.com/rooms/50049428"
"Palazzolo Acreide, Sicilia, Italy","37.06","14.925","Unique restored miller's house with private pool","8","Entire villa","5","https://www.airbnb.com/rooms/15280562"
"Honolulu, Hawaii, United States","21.27208","-157.82275","Luxury Condo/2 Minute Walk to Beach/Free Parking","6","Entire condo","5","https://www.airbnb.com/rooms/35032682"
"Woodside, California, United States","37.43118","-122.24914","Secluded, Modern, sunny and gated estate. 2 BR +","6","Entire home","5","https://www.airbnb.com/rooms/26928860"
"Crosby-on-Eden, near Carlisle, England, United Kingdom","54.92497","-2.88353","Eden Grove (UK12701)","8","Entire home",,"https://www.airbnb.com/rooms/40960928"
"New York, United States","40.70825","-74.00487","Sonder at One Platt | Three-Bedroom Apartment","8","Entire rental unit","5","https://www.airbnb.com/rooms/38486378"
"Vorno, Lucca, Italy","43.79449","10.52106","Chiodo","10","Entire villa","4.5","https://www.airbnb.com/rooms/26202290"
"Florence, Toscana, Italy","43.76579","11.24981","Luxury Apartment with view on Piazza Pitti","10","Entire condo","5","https://www.airbnb.com/rooms/53841208"
"Las Vegas, Nevada, United States","36.10877","-115.16962","2 BDRM 2 KING PRMR SUITE SOFABED NO RESORT FEES!","8","Room in boutique hotel","5","https://www.airbnb.com/rooms/36915351"
"Long Marston, England, United Kingdom","53.94931","-1.29914","The Granary, near York with Hot Tub","12","Entire home","5","https://www.airbnb.com/rooms/36993336"
"Stateline, Nevada, United States","38.95895","-119.88852","Stage Coach Run - Ski Side Large Beauty!","14","Entire home","4.5","https://www.airbnb.com/rooms/26011068"
"Koloa, Hawaii, United States","21.88513","-159.46427","Hale Luna 3BR /2BR-Walking Distance to the Beach","6","Entire home","5","https://www.airbnb.com/rooms/25239186"
"Hollywood, Florida, United States","26.01142","-80.19697","Modern 4 bdrm home, spacious outdoors, heated pool","8","Entire home","5","https://www.airbnb.com/rooms/52134615"
"Hong Kong, Hong Kong Island, Hong Kong","22.28119","114.18421","Oasis within CWB-Busy Heart Centre of HK! 4-10ppl","10","Entire condo",,"https://www.airbnb.com/rooms/726620257356404900"
"Wavre, Walloon Region, Belgium","50.73483","4.55944","20 minutes from Brussels Airport","15","Entire home","5","https://www.airbnb.com/rooms/3651645"
